name,listing_url,neighbourhood,latitude,longitude,price,room_type,review_scores_rating,entertainment,food
Monthly (or Longer ) Designer One Bedroom Downtown,https://www.airbnb.com/rooms/13358,,49.28201,-123.12669,100.0,Entire home/apt,4.67,75,291645
Vancouver's best kept secret,https://www.airbnb.com/rooms/13490,"Vancouver, British Columbia, Canada",49.25622,-123.06607,150.0,Entire home/apt,4.92,0,0
EcoLoft Vancouver,https://www.airbnb.com/rooms/14267,"Vancouver, British Columbia, Canada",49.24922,-123.08139,150.0,Entire home/apt,4.76,0,0
Spacious one-bedroom in sought-after Strathcona,https://www.airbnb.com/rooms/14424,,49.27921,-123.08835,166.0,Entire home/apt,4.69,0,0
Close to PNE/Hastings Park Garden level suite,https://www.airbnb.com/rooms/16254,"Vancouver, British Columbia, Canada",49.27721,-123.04086,350.0,Entire home/apt,4.57,0,0
"1 block to skytrain station, shops,restaurant,bank",https://www.airbnb.com/rooms/16611,"Vancouver, British Columbia, Canada",49.26339,-123.07145,100.0,Entire home/apt,4.0,0,0
Vancouver 3br 3ba house 20min to DT,https://www.airbnb.com/rooms/17158,"Vancouver, British Columbia, Canada",49.25277,-123.03774,195.0,Entire home/apt,5.0,0,0
"Central location, nice little apartment",https://www.airbnb.com/rooms/17765,"Vancouver, British Columbia, Canada",49.26132,-123.10845,94.0,Entire home/apt,4.6,0,0
private rm in clean central 2BR apt,https://www.airbnb.com/rooms/18270,"Vancouver, British Columbia, Canada",49.26557,-123.096,51.0,Private room,4.54,0,0
Commercial Drive B&B,https://www.airbnb.com/rooms/18589,"Vancouver, British Columbia, Canada",49.27569,-123.07057,106.0,Private room,4.98,0,0
*Best choice in downtown-5 Stars * -2,https://www.airbnb.com/rooms/18795,,49.28299,-123.13008,85.0,Private room,4.56,0,13203
Spacious Apartment near Granville Island and VGH,https://www.airbnb.com/rooms/19527,"Vancouver, British Columbia, Canada",49.26018,-123.13477,133.0,Entire home/apt,4.69,0,0
Beautiful 2 Br 2 Bath + Den Yaletown Seawall,https://www.airbnb.com/rooms/19621,"Vancouver, British Columbia, Canada",49.27323,-123.12032,190.0,Entire home/apt,4.0,0,75872
Bright & Cheerful Uptown Garden Suite,https://www.airbnb.com/rooms/20085,"Vancouver, British Columbia, Canada",49.25636,-123.08636,99.0,Entire home/apt,4.82,0,0
"Relocating , working in North Vancouver ?",https://www.airbnb.com/rooms/20369,"North Vancouver, British Columbia, Canada",49.30689,-123.03184,195.0,Entire home/apt,3.67,0,0
Hotel alternative furnished rooms in B&B North Van,https://www.airbnb.com/rooms/20377,"North Vancouver, British Columbia, Canada",49.30581,-123.06809,249.0,Private room,5.0,0,0
PRIVATE ROOM + BATH + KING BED + dedicated entry,https://www.airbnb.com/rooms/21912,"Vancouver, British Columbia, Canada",49.23361,-123.05283,75.0,Private room,4.7,0,0
PRIVATE  SUITE (KITCHEN+ BEDROOM+BATH+LIVING ROOM),https://www.airbnb.com/rooms/21913,"Vancouver, British Columbia, Canada",49.23442,-123.05307,102.0,Entire home/apt,4.74,0,0
Walker's paradise in Kitsilano,https://www.airbnb.com/rooms/24273,"Vancouver, British Columbia, Canada",49.26216,-123.1715,140.0,Entire home/apt,5.0,0,0
The Alpha Downtown by COMFYSUITES,https://www.airbnb.com/rooms/26047,"Vancouver, British Columbia, Canada",49.28086,-123.12375,160.0,Entire home/apt,4.76,231,1012433
Designer Urban Park View Townhouse,https://www.airbnb.com/rooms/32746,,49.2792,-123.105,127.0,Entire home/apt,4.27,0,229885
“Suite on Main”  near  Q.E Park,https://www.airbnb.com/rooms/33150,"Vancouver, British Columbia, Canada",49.24677,-123.1048,165.0,Entire home/apt,4.98,0,0
FURNISHED 2Br + 2Br Yaletown PRIME location!,https://www.airbnb.com/rooms/35102,"Vancouver, British Columbia, Canada",49.27743,-123.11869,147.0,Entire home/apt,4.72,57,1067638
"Private Quiet Studio in the HEART of ""The Drive""",https://www.airbnb.com/rooms/35304,,49.2729,-123.06973,109.0,Entire home/apt,4.73,0,0
The Charlie Downtown by COMFYSUITES,https://www.airbnb.com/rooms/42645,"Vancouver, British Columbia, Canada",49.28036,-123.1234,169.0,Entire home/apt,4.79,260,1221152
Executive Furnished Apartment (2 months minimum),https://www.airbnb.com/rooms/48146,"Vancouver, British Columbia, Canada",49.23653,-123.02664,110.0,Entire home/apt,,0,0
Boutique Studio Apartment in Kits!,https://www.airbnb.com/rooms/49736,"Vancouver, British Columbia, Canada",49.26778,-123.14674,1950.0,Entire home/apt,4.89,0,0
Yaletown 1 Bedroom Condo,https://www.airbnb.com/rooms/54261,,49.27462,-123.12426,89.0,Entire home/apt,4.85,24,555025
"Open-concept, Modern Heritage Home with over 20 Skylights",https://www.airbnb.com/rooms/70453,"Vancouver, British Columbia, Canada",49.27836,-123.08716,592.0,Entire home/apt,4.94,0,0
Central Convenient Vibrant Neighbourhood!,https://www.airbnb.com/rooms/72659,,49.27345,-123.07031,210.0,Entire home/apt,4.91,0,0
Amazing Downtown Vancouver Condo!,https://www.airbnb.com/rooms/73841,"Vancouver, British Columbia, Canada",49.27591,-123.12359,129.0,Entire home/apt,4.74,61,1176822
Room with a Garden View!,https://www.airbnb.com/rooms/77157,"Vancouver, British Columbia, Canada",49.2452,-123.16544,145.0,Entire home/apt,4.82,0,0
Your Downtown Executive Suite,https://www.airbnb.com/rooms/98830,"Vancouver, British Columbia, Canada",49.27936,-123.12443,135.0,Entire home/apt,4.88,284,1355952
Main Street Vineyard,https://www.airbnb.com/rooms/125176,"Vancouver, British Columbia, Canada",49.24615,-123.09462,105.0,Private room,4.69,0,0
"West view, Transit convenient, clean & comfortable",https://www.airbnb.com/rooms/134688,,49.24356,-123.04757,40.0,Private room,4.59,0,0
"1905 Heritage Loft, Main/Broadway, Olympic Village",https://www.airbnb.com/rooms/140698,"Vancouver, British Columbia, Canada",49.26382,-123.10484,99.0,Entire home/apt,4.84,0,0
Family friendly Point Grey Home,https://www.airbnb.com/rooms/170137,"Vancouver, British Columbia, Canada",49.25757,-123.18966,175.0,Entire home/apt,4.87,0,0
Charming and Homely Downtown Penthouse,https://www.airbnb.com/rooms/172827,"Vancouver, British Columbia, Canada",49.28034,-123.12648,400.0,Entire home/apt,4.86,187,674626
VANCOUVER'S BEST PRIVATE SUITE/LOFT,https://www.airbnb.com/rooms/174135,"Vancouver, British Columbia, Canada",49.27857,-123.0899,90.0,Entire home/apt,4.8,0,0
KITS SUPER CENTRAL DELIGHTFULL APT!,https://www.airbnb.com/rooms/182451,"Vancouver, British Columbia, Canada",49.25808,-123.16824,131.0,Entire home/apt,4.88,0,0
A Real Gem in the Heart of Kits,https://www.airbnb.com/rooms/219261,"Vancouver, British Columbia, Canada",49.2719,-123.15043,210.0,Entire home/apt,4.58,0,0
"Stunning views, comfort, location!!",https://www.airbnb.com/rooms/248014,"Vancouver, British Columbia, Canada",49.29103,-123.05782,100.0,Entire home/apt,5.0,0,0
Heritage Loft in heart of Gastown,https://www.airbnb.com/rooms/254657,"Vancouver, British Columbia, Canada",49.28375,-123.10383,250.0,Entire home/apt,4.91,0,226948
Luxury Coach House in Kitsilano,https://www.airbnb.com/rooms/256178,"Vancouver, British Columbia, Canada",49.26293,-123.17143,170.0,Entire home/apt,5.0,0,0
FABULOUS Luxury Downtown Vancouver!,https://www.airbnb.com/rooms/258636,,49.27839,-123.12852,99.0,Entire home/apt,4.79,52,559214
Sunset views - LGBTQ2+ friendly,https://www.airbnb.com/rooms/306178,,49.23273,-123.02747,84.0,Private room,4.95,0,0
Close to downtown/shops/restaurants/skytrain,https://www.airbnb.com/rooms/311354,"Vancouver, British Columbia, Canada",49.26328,-123.07086,100.0,Entire home/apt,4.0,0,0
Modern Yaletown 1BR | GREAT VIEW + CENTRAL,https://www.airbnb.com/rooms/322824,,49.27608,-123.12452,182.0,Entire home/apt,4.89,62,1151637
Stylish Modern Central Downtown★★★★★★★,https://www.airbnb.com/rooms/359942,"Vancouver, British Columbia, Canada",49.27634,-123.11825,263.0,Private room,4.85,26,534605
Bright Spacious Bedroom Pvt Bath,https://www.airbnb.com/rooms/377706,"Vancouver, British Columbia, Canada",49.27799,-123.07101,48.0,Private room,4.68,0,0
"LARGE PRIVATE ROOM+BATH, KING BED, dedicated entry",https://www.airbnb.com/rooms/415700,"Vancouver, British Columbia, Canada",49.2332,-123.0551,83.0,Private room,4.73,0,0
Trendy & Spacious 2 bd Gastown Loft,https://www.airbnb.com/rooms/436032,,49.28211,-123.10453,290.0,Entire home/apt,4.83,0,632463
Home (Office) Away from Home – Heart of Downtown,https://www.airbnb.com/rooms/448104,"Vancouver, British Columbia, Canada",49.28063,-123.12502,162.0,Entire home/apt,4.88,226,841728
Beautiful room (s) Vancouver Home,https://www.airbnb.com/rooms/461386,,49.23034,-123.02971,141.0,Private room,4.42,0,0
"House in sought-after Sunrise Hastings, Vancouver",https://www.airbnb.com/rooms/464172,,49.28586,-123.05563,231.0,Entire home/apt,4.8,0,0
Inspiring Gastown loft with deck + rooftop,https://www.airbnb.com/rooms/475296,,49.28241,-123.10381,350.0,Entire home/apt,4.85,0,466717
Vancouver One Bedroom,https://www.airbnb.com/rooms/485225,,49.28052,-123.12691,358.0,Entire home/apt,4.0,163,618067
"Downtown 1Bed+Den, stylish & modern",https://www.airbnb.com/rooms/496298,,49.28062,-123.11815,124.0,Entire home/apt,4.92,52,1641056
Central Modern House with View and 2 Kitchens,https://www.airbnb.com/rooms/498112,"Vancouver, British Columbia, Canada",49.25099,-123.07457,375.0,Entire home/apt,4.7,0,0
Modern Architectural lakeside Home On The Park,https://www.airbnb.com/rooms/540348,"Vancouver, British Columbia, Canada",49.25759,-123.06393,500.0,Entire home/apt,4.91,0,0
Moments from downtown Vancouver!,https://www.airbnb.com/rooms/544358,,49.27234,-123.01326,145.0,Entire home/apt,4.26,0,0
Commercial Dr West Coast Garden Ste,https://www.airbnb.com/rooms/557357,"Vancouver, British Columbia, Canada",49.27917,-123.06246,80.0,Entire home/apt,4.89,0,0
Sub-Penthouse with Amazing Views in Heart of City,https://www.airbnb.com/rooms/622217,"Vancouver, British Columbia, Canada",49.27999,-123.1075,556.0,Entire home/apt,4.96,4,548261
Close to Jericho beach garden level open space.,https://www.airbnb.com/rooms/625396,,49.27066,-123.18291,380.0,Private room,4.76,0,0
Quiet Oasis Garden Suite - Steps from the Drive,https://www.airbnb.com/rooms/648026,"Vancouver, British Columbia, Canada",49.26775,-123.06862,84.0,Entire home/apt,4.87,0,0
English Bay Hideaway @ Stanley Park,https://www.airbnb.com/rooms/654744,"Vancouver, British Columbia, Canada",49.29178,-123.14175,150.0,Entire home/apt,4.75,0,1076
1 Bedroom Private Furnished Suite,https://www.airbnb.com/rooms/654763,,49.2506,-123.07175,52.0,Entire home/apt,4.7,0,0
Nice room in amazing luxury home near DOWNTOWN+UBC,https://www.airbnb.com/rooms/659986,"Vancouver, British Columbia, Canada",49.24413,-123.11955,96.0,Private room,4.33,0,0
Entire cute  condo full of art,https://www.airbnb.com/rooms/703179,"Vancouver, British Columbia, Canada",49.27945,-123.10875,190.0,Entire home/apt,4.8,4,245615
Luxury Seaview Studio Suite - Westend,https://www.airbnb.com/rooms/713271,,49.28104,-123.13621,135.0,Entire home/apt,4.77,0,6970
Kitsilano Laneway House - Quiet Neighbourhood,https://www.airbnb.com/rooms/731219,"Vancouver, British Columbia, Canada",49.26026,-123.18195,150.0,Entire home/apt,4.92,0,0
English Bay Views,https://www.airbnb.com/rooms/735468,,49.28059,-123.1364,200.0,Entire home/apt,4.63,0,7207
Kitsilano 2 bdrm Garden Level Suite,https://www.airbnb.com/rooms/755558,"Vancouver, British Columbia, Canada",49.25996,-123.16653,125.0,Entire home/apt,4.86,0,0
Very Convenient Mini-suite,https://www.airbnb.com/rooms/763445,,49.24438,-123.04453,62.0,Entire home/apt,4.76,0,0
Level | Studio | Lux Amenities Downtown Vancouver,https://www.airbnb.com/rooms/771366,"Vancouver, British Columbia, Canada",49.2794,-123.12181,225.0,Entire home/apt,5.0,297,1851521
Level | Two Bedroom Suite | Lux Amenities Downtown,https://www.airbnb.com/rooms/771380,"Vancouver, British Columbia, Canada",49.27918,-123.12187,375.0,Entire home/apt,4.67,293,1856957
The Garden Quarter in Kitsilano,https://www.airbnb.com/rooms/784153,"Vancouver, British Columbia, Canada",49.26186,-123.17438,92.0,Entire home/apt,4.79,0,0
The Nook in Kitsilano,https://www.airbnb.com/rooms/785297,"Vancouver, British Columbia, Canada",49.26355,-123.17326,86.0,Private room,4.89,0,0
The Garden Nook in Kitsilano,https://www.airbnb.com/rooms/785752,"Vancouver, British Columbia, Canada",49.26213,-123.17482,134.0,Entire home/apt,5.0,0,0
Exellent for International Student,https://www.airbnb.com/rooms/796603,,49.28087,-123.13525,30.0,Shared room,,0,9104
fully furnished suite near VGH,https://www.airbnb.com/rooms/801222,,49.25804,-123.12119,106.0,Entire home/apt,4.59,0,0
East Village Private Garden Gem!,https://www.airbnb.com/rooms/824612,"Vancouver, British Columbia, Canada",49.28618,-123.05403,84.0,Entire home/apt,4.58,0,0
Sunny room with private bathroom and large patio,https://www.airbnb.com/rooms/874731,"Vancouver, British Columbia, Canada",49.25785,-123.12199,139.0,Private room,4.53,0,0
Heritage Home near Kits Beach,https://www.airbnb.com/rooms/875309,"Vancouver, British Columbia, Canada",49.27073,-123.16325,375.0,Entire home/apt,4.74,0,0
"Dunbar near UBC: Clean, comfortable + quiet",https://www.airbnb.com/rooms/885600,"Vancouver, British Columbia, Canada",49.24803,-123.18517,130.0,Entire home/apt,4.92,0,0
Private apartment-Yaletown Downtown,https://www.airbnb.com/rooms/958090,,49.27744,-123.11524,434.0,Entire home/apt,4.2,4,181454
Oakridge Canada Line completely renovated home,https://www.airbnb.com/rooms/961006,"Vancouver, British Columbia, Canada",49.23569,-123.10987,219.0,Entire home/apt,4.33,0,0
Spacious Room in Character Home,https://www.airbnb.com/rooms/961831,,49.26648,-123.15939,150.0,Private room,5.0,0,0
"261 Yaletown Studio at ""Space""",https://www.airbnb.com/rooms/980511,"Vancouver, British Columbia, Canada",49.27489,-123.12654,82.0,Entire home/apt,4.78,15,352778
152 Studio (no Bedroom),https://www.airbnb.com/rooms/994969,"Vancouver, British Columbia, Canada",49.28006,-123.12673,79.0,Entire home/apt,4.5,180,693694
159 2 BEDROOM/ 2 FULL BATH-ideal for sharing!,https://www.airbnb.com/rooms/995174,,49.28837,-123.12766,110.0,Entire home/apt,4.62,0,121659
S2-LUXURIOUS 2-BR/2-Baths/2-Balcony,https://www.airbnb.com/rooms/1007137,,49.27804,-123.12531,280.0,Entire home/apt,4.0,250,1496264
S1-VIBRANT DOWNTOWN 1-BR + den!,https://www.airbnb.com/rooms/1007144,,49.27828,-123.12671,180.0,Entire home/apt,5.0,174,989575
comfy stay in clean victorian house,https://www.airbnb.com/rooms/1012385,"Vancouver, British Columbia, Canada",49.25674,-123.0874,120.0,Entire home/apt,4.78,0,0
"Light-filled, self-contained studio in Strathcona",https://www.airbnb.com/rooms/1015935,,49.2804,-123.08908,115.0,Entire home/apt,4.8,0,0
Deluxe Junior One Bedroom (2 Beds),https://www.airbnb.com/rooms/1021607,"Vancouver, British Columbia, Canada",49.27747,-123.12098,75.0,Entire home/apt,4.84,147,1697567
Yaletown Deluxe Studio Condominium,https://www.airbnb.com/rooms/1021669,"Vancouver, British Columbia, Canada",49.27703,-123.12692,75.0,Entire home/apt,4.75,47,873863
Artist's Character home in 'hip' Commercial Drive,https://www.airbnb.com/rooms/1032892,"Vancouver, British Columbia, Canada",49.27241,-123.06332,95.0,Private room,4.83,0,0
Quiet space minutes from downtown!,https://www.airbnb.com/rooms/1061895,"Vancouver, British Columbia, Canada",49.24166,-123.0407,93.0,Private room,4.77,0,0
136 Lord Stanley Great price!,https://www.airbnb.com/rooms/1109821,"Vancouver, British Columbia, Canada",49.29258,-123.13446,72.0,Entire home/apt,4.45,0,33382
Family-Friendly Kitsilano House with Mountain Views,https://www.airbnb.com/rooms/1113551,"Vancouver, British Columbia, Canada",49.26008,-123.15989,560.0,Entire home/apt,4.83,0,0
*Best choice in downtown-5 Stars * -3,https://www.airbnb.com/rooms/1118858,,49.28239,-123.13021,85.0,Private room,4.54,0,21638
Yaletown/Downtown  1 Bedroom Condo,https://www.airbnb.com/rooms/1126273,,49.28119,-123.12033,99.0,Entire home/apt,0.0,66,1552729
2 Bdrm in Strathcona,https://www.airbnb.com/rooms/1141457,,49.27925,-123.08814,180.0,Entire home/apt,4.75,0,0
Bright & Tidy Character Apartment,https://www.airbnb.com/rooms/1162198,"Vancouver, British Columbia, Canada",49.2726,-123.06988,50.0,Private room,4.69,0,0
Cozy space in East Vancouver,https://www.airbnb.com/rooms/1178149,"Vancouver, British Columbia, Canada",49.26957,-123.04828,90.0,Entire home/apt,4.91,0,0
Elegant Main floor House Vancouver,https://www.airbnb.com/rooms/1187929,"Vancouver, British Columbia, Canada",49.24965,-123.07027,175.0,Entire home/apt,4.83,0,0
Beautiful Kitsilano Character home. Great Location,https://www.airbnb.com/rooms/1191143,,49.26716,-123.17653,416.0,Entire home/apt,4.73,0,0
Cool cozy place on The Drive w central A/C!,https://www.airbnb.com/rooms/1214617,"Vancouver, British Columbia, Canada",49.26731,-123.06909,229.0,Entire home/apt,4.87,0,0
Stunning Suite Heart of DT w/Parking and Office,https://www.airbnb.com/rooms/1223989,"Vancouver, British Columbia, Canada",49.27843,-123.12901,135.0,Entire home/apt,4.85,33,503495
Brand new 3 bedroom home in central Vancouver,https://www.airbnb.com/rooms/1229506,,49.26596,-123.06844,520.0,Entire home/apt,4.9,0,0
Private Hotel-Style Suite in a Downtown Boutique High-Rise,https://www.airbnb.com/rooms/1273760,"Vancouver, British Columbia, Canada",49.28478,-123.1192,252.0,Private room,4.86,0,1172120
Clean New Kits 3 bedroom/ 2bath!,https://www.airbnb.com/rooms/1291394,"Vancouver, British Columbia, Canada",49.26889,-123.18543,150.0,Entire home/apt,4.9,0,0
"Beautiful Mount Pleasant home, close to everything",https://www.airbnb.com/rooms/1309315,"Vancouver, British Columbia, Canada",49.26719,-123.10982,399.0,Entire home/apt,4.29,0,0
120 501 Pacific,https://www.airbnb.com/rooms/1316419,"Vancouver, British Columbia, Canada",49.28279,-123.1222,72.0,Entire home/apt,4.5,34,969912
224 Yaletown Park.  Long term stay welcome,https://www.airbnb.com/rooms/1316477,"Vancouver, British Columbia, Canada",49.27859,-123.11993,95.0,Entire home/apt,4.86,154,1624284
Cosy 1 bedroom apt Mount Pleasant,https://www.airbnb.com/rooms/1324743,"Vancouver, British Columbia, Canada",49.25909,-123.10415,92.0,Entire home/apt,4.6,0,0
Close to Anywhere: Location Location Location,https://www.airbnb.com/rooms/1343411,"Vancouver, British Columbia, Canada",49.27627,-123.10013,95.0,Entire home/apt,4.7,0,48
*Best choice in downtown-5 Stars* -1,https://www.airbnb.com/rooms/1343519,,49.28247,-123.13068,85.0,Private room,4.45,0,20001
Ultra Modern Apartment in Yaletow,https://www.airbnb.com/rooms/1360765,,49.284,-123.11432,97.0,Entire home/apt,4.75,0,1679199
Private space in heritage home in lovely area,https://www.airbnb.com/rooms/1361276,"Vancouver, British Columbia, Canada",49.25808,-123.07538,150.0,Entire home/apt,4.69,0,0
AMAZING LOCATION 1BD CHARMING APT IN DOWNTOWN,https://www.airbnb.com/rooms/1365609,"Vancouver, British Columbia, Canada",49.27932,-123.12911,278.0,Entire home/apt,4.88,38,500371
QUIET COZY SUNNY BR (ENSUITE) + ADJ STUDY IN HOUSE,https://www.airbnb.com/rooms/1378220,"Vancouver, British Columbia, Canada",49.26026,-123.20135,122.0,Entire home/apt,4.68,0,0
"Luxury 2Bd, 2Offices, amazing views, gym and pool",https://www.airbnb.com/rooms/1393599,"Vancouver, British Columbia, Canada",49.27392665039039,-123.10068941104272,200.0,Entire home/apt,,0,0
Stunning 1 Bedroom Laneway,https://www.airbnb.com/rooms/1398788,"Vancouver, British Columbia, Canada",49.23968,-123.16762,134.0,Entire home/apt,4.9,0,0
Luxury 2 BDR With Wrap Around Deck,https://www.airbnb.com/rooms/1399744,"Vancouver, British Columbia, Canada",49.26964,-123.11064,450.0,Entire home/apt,4.75,0,0
Renovated Character Home - 3 Bdrm,https://www.airbnb.com/rooms/1417881,"Vancouver, British Columbia, Canada",49.26732,-123.06827,349.0,Entire home/apt,4.86,0,0
UBC CAMPUS cozy student bdrm apt share with host,https://www.airbnb.com/rooms/1442216,"Vancouver, British Columbia, Canada",49.25826,-123.23352,162.0,Private room,4.86,0,0
One Bedroom & Secured Underground Parking,https://www.airbnb.com/rooms/1466647,"Vancouver, British Columbia, Canada",49.28164,-123.11006,199.0,Entire home/apt,4.23,4,1073363
244 -2 BEDROOM. WATER VIEW! 6 MONTH EXTENDED STAY,https://www.airbnb.com/rooms/1502887,"Vancouver, British Columbia, Canada",49.29014,-123.12716,129.0,Entire home/apt,4.8,0,30030
Modern new room with private entry!,https://www.airbnb.com/rooms/1507975,"Vancouver, British Columbia, Canada",49.24882,-123.09121,81.0,Private room,4.72,0,0
"114 Studio ""West of Denman""",https://www.airbnb.com/rooms/1525113,"Vancouver, British Columbia, Canada",49.29101,-123.14085,76.0,Entire home/apt,4.42,0,27975
Deluxe Kitsilano Beach Waterfront 2 Bedroom House,https://www.airbnb.com/rooms/1565861,"Vancouver, British Columbia, Canada",49.27383,-123.15362,450.0,Entire home/apt,4.92,0,0
Lakeside Cottage with Stunning View,https://www.airbnb.com/rooms/1610084,"Vancouver, British Columbia, Canada",49.25936,-123.06131,172.0,Entire home/apt,4.87,0,0
Private top floor on vibrant Main St,https://www.airbnb.com/rooms/1623556,"Vancouver, British Columbia, Canada",49.25259,-123.09292,92.0,Entire home/apt,4.67,0,0
Garden Suite-Quiet/Private&Central,https://www.airbnb.com/rooms/1629480,"Vancouver, British Columbia, Canada",49.25225,-123.10756,85.0,Entire home/apt,4.82,0,0
Amazing 2000sq ft Downtown loft 3 patios + Parking,https://www.airbnb.com/rooms/1657214,"Vancouver, British Columbia, Canada",49.28167,-123.10984,250.0,Entire home/apt,5.0,4,1092783
Beautiful Kitsilano Apartment..,https://www.airbnb.com/rooms/1703616,"Vancouver, British Columbia, Canada",49.26548,-123.14579,156.0,Entire home/apt,4.0,0,0
2 Bedroom Garden Flat - Main Street,https://www.airbnb.com/rooms/1717967,"Vancouver, British Columbia, Canada",49.24778,-123.09867,186.0,Entire home/apt,4.92,0,0
DT Ocean view with luxury amenities and parking,https://www.airbnb.com/rooms/1733307,"Vancouver, British Columbia, Canada",49.27781,-123.10637,288.0,Entire home/apt,4.9,0,18930
SoMa Suite - Main Street Cool,https://www.airbnb.com/rooms/1768817,"Vancouver, British Columbia, Canada",49.24489,-123.10302,105.0,Entire home/apt,4.87,0,0
Yaletown high rise studio,https://www.airbnb.com/rooms/1778529,"Vancouver, British Columbia, Canada",49.27695,-123.11922,93.0,Entire home/apt,4.46,67,1118581
Film Industry loves this house! 5 min to VGH,https://www.airbnb.com/rooms/1820919,"Vancouver, British Columbia, Canada",49.2585,-123.11479,395.0,Entire home/apt,4.92,0,0
Cozy Retreat - Strathcona,https://www.airbnb.com/rooms/1830733,,49.27866,-123.08627,125.0,Entire home/apt,4.9,0,0
Main Street loft w/ rooftop terrace and view!,https://www.airbnb.com/rooms/1850984,"Vancouver, British Columbia, Canada",49.26772,-123.0975,300.0,Entire home/apt,4.77,0,0
156 One Bedroom in Downtown at The Electra,https://www.airbnb.com/rooms/1869071,"Vancouver, British Columbia, Canada",49.28216,-123.12438,87.0,Entire home/apt,4.75,95,586963
Tinseltown Apartment,https://www.airbnb.com/rooms/1898584,,49.27915,-123.10642,79.0,Entire home/apt,4.74,0,219376
Commercial Drive Garden Suite,https://www.airbnb.com/rooms/1932171,"Vancouver, British Columbia, Canada",49.26861,-123.06666,97.0,Entire home/apt,4.64,0,0
Stylish and Modern 2Bed West End Suite!,https://www.airbnb.com/rooms/1950844,,49.28954,-123.13711,237.0,Entire home/apt,4.58,0,163899
"Charming ""Kitsilano Family Place""",https://www.airbnb.com/rooms/1995592,"Vancouver, British Columbia, Canada",49.263252,-123.164825,110.0,Private room,4.6,0,0
GREAT SUITE w GARDEN PATIO!  CENTRALLY LOCATED!!,https://www.airbnb.com/rooms/2003897,"Vancouver, British Columbia, Canada",49.26263,-123.11627,130.0,Entire home/apt,5.0,0,0
Amazing View from a Modern Loft,https://www.airbnb.com/rooms/2008047,,49.28519,-123.09872,160.0,Entire home/apt,4.83,0,0
Sunny family-friendly house in Kits,https://www.airbnb.com/rooms/2011559,"Vancouver, British Columbia, Canada",49.26057,-123.15881,575.0,Entire home/apt,4.89,0,0
Experience Vancouver on the Drive!,https://www.airbnb.com/rooms/2017305,"Vancouver, British Columbia, Canada",49.26411,-123.06803,189.0,Entire home/apt,4.64,0,0
Beautiful Kitsilano - Covid-19 Safe,https://www.airbnb.com/rooms/2033952,"Vancouver, British Columbia, Canada",49.26715,-123.15325,99.0,Entire home/apt,4.67,0,0
"Kitsilano Point, very clean, welcoming and bright",https://www.airbnb.com/rooms/2041582,"Vancouver, British Columbia, Canada",49.2753,-123.14721,120.0,Entire home/apt,4.96,0,0
Yaletown 1BD Condo @ Homer & Robson,https://www.airbnb.com/rooms/2042431,"Vancouver, British Columbia, Canada",49.28005,-123.11659,150.0,Entire home/apt,4.89,41,1103689
2 bdrm in COMPLETLY RENOVATED HOME BY CANADA LINE,https://www.airbnb.com/rooms/2046259,"Vancouver, British Columbia, Canada",49.23573,-123.10819,219.0,Entire home/apt,4.43,0,0
Cozy Modern apartment in Yaletown,https://www.airbnb.com/rooms/2056676,,49.27393,-123.11599,110.0,Entire home/apt,4.49,0,19704
Gorgeous New House Double Ensuite,https://www.airbnb.com/rooms/2084273,"Vancouver, British Columbia, Canada",49.24976,-123.03547,75.0,Private room,4.84,0,0
A spacious modern apartment,https://www.airbnb.com/rooms/2092610,"Vancouver, British Columbia, Canada",49.2655,-123.0969,150.0,Entire home/apt,4.73,0,0
Gorgeous New House Single Ensuite,https://www.airbnb.com/rooms/2106364,"Vancouver, British Columbia, Canada",49.24958,-123.0359,65.0,Private room,4.81,0,0
good sized bedroom on second floor,https://www.airbnb.com/rooms/2108899,"Vancouver, British Columbia, Canada",49.26933,-123.16177,48.0,Private room,4.7,0,0
small room with single bed by beach,https://www.airbnb.com/rooms/2109035,"Vancouver, British Columbia, Canada",49.26791,-123.16117,35.0,Private room,5.0,0,0
# C -Private Studio 20 min to Downtown Vancouver,https://www.airbnb.com/rooms/2145092,"Burnaby, British Columbia, Canada",49.25317,-123.01296,103.0,Entire home/apt,4.76,0,0
